{"correction_ref":null,"correction_state":"ACTIVE","decision":"APPROVED","expires_at":"2026-10-01T00:00:00Z","package_id":"sha256:bf9b5f9b6c237b5ff7fec943c1682a0381902bb5ae451026acc736675b5741ab","policy_ref":"kfm://synthetic/policy","profile":"kfm.water-release-decision/v1","release_ref":"kfm://synthetic/release","released_at":"2026-09-30T18:45:00Z","releaser":"synthetic-releaser","review_ref":"kfm://synthetic/review","reviewed_at":"2026-09-30T18:30:00Z","reviewer":"synthetic-reviewer","rights_ref":"kfm://synthetic/rights","sensitivity_ref":"kfm://synthetic/sensitivity","source_admission_ref":"kfm://synthetic/source_admission"}